{
  "expenseId": "500123",
  "transactionDate": "example_value",
  "businessPurpose": "example_value",
  "allocationState": "example_value",
  "isPersonalExpense": true,
  "isExpenseRejected": true,
  "isPaperReceiptReceived": true,
  "hasExceptions": true,
  "invoiceId": "500123",
  "customData": [],
  "lastModifiedDate": "example_value",
  "links": []
}